{
  "meta": {
    "title": "seo beratung | offer_seo",
    "description": "Stub description for seo beratung.",
    "canonical": "/seo-beratung",
    "robots": "index,follow"
  },
  "url": {
    "slug": "/seo-beratung",
    "breadcrumbs": [
      "seo beratung"
    ]
  },
  "content": {
    "h1": "seo beratung",
    "sections": [],
    "body": "Stub content for seo beratung."
  },
  "internal_links": {
    "outbound": [],
    "inbound_suggestions": []
  },
  "schema": {
    "jsonld": "{}",
    "notes": "stub"
  },
  "qa": {
    "status": "WARN",
    "fail_rules": [],
    "warn_rules": [
      "TITLE_PRIMARY_KEYWORD",
      "META_DESCRIPTION_PRIMARY_KEYWORD",
      "SLUG_PRIMARY_KEYWORD",
      "H1_PRIMARY_KEYWORD",
      "KEYWORD_STUFFING",
      "DUPLICATE_CONTENT_RISK",
      "CANNIBALIZATION_CONFLICT"
    ],
    "fix_list": [
      {
        "rule_id": "KEYWORD_STUFFING",
        "message": "Keyword density too high.",
        "fix_instructions": "Reduce repeated use of the primary keyword.",
        "evidence": {
          "occurrences": 1,
          "word_count": 5,
          "density": 0.2,
          "maxDensity": 0.03
        }
      },
      {
        "rule_id": "DUPLICATE_CONTENT_RISK",
        "message": "Not checked: missing data.",
        "evidence": {
          "field": "duplicate_report"
        }
      },
      {
        "rule_id": "CANNIBALIZATION_CONFLICT",
        "message": "Not checked: missing data.",
        "evidence": {
          "field": "cannibalization_report"
        }
      }
    ],
    "completeness_score": 100,
    "assumptions": [
      "Stub generator"
    ],
    "checks_run": 11,
    "rule_score": 73
  }
}
